<?xml version="1.0" encoding="UTF-8"?><!--Sample XML file generated by XMLSPY v2004 rel. 3 U (http://www.xmlspy.com)--><Displays schema-element="xnat:investigatorData" value_field="INVESTIGATOR_ID" display_field="INVESTIGATOR_NAME" display_label="Investigator" xmlns:xsi="http://www.w3.org/2001/XMLSchema-instance" xsi:noNamespaceSchemaLocation="../../xdat/display.xsd">	<DisplayField id="INVESTIGATOR_ID" header="Investigator Id" visible="true">		<DisplayFieldElement name="Field1" schema-element="xnat:investigatorData.xnat_investigatorData_id"/>	</DisplayField>	<DisplayField id="RPT" header="" visible="true" image="true">		<Content type="sql">'/@WEBAPP/images/r.gif'::text</Content>		<HTML-Link>			<Property name="HREF" value="none"/>			<Property name="ONCLICK" value="return rpt('@Field1','xnat:investigatorData','xnat:investigatorData.xnat_investigatorData_id');">				<InsertValue id="Field1" field="INVESTIGATOR_ID"/>			</Property>		</HTML-Link>	</DisplayField>	<DisplayField id="INVESTIGATOR_NAME" header="Name" visible="true">		<DisplayFieldElement name="Field2" schema-element="xnat:investigatorData.firstname"/>		<DisplayFieldElement name="Field3" schema-element="xnat:investigatorData.lastname"/>		<Content type="sql">@Field2 || ' ' || @Field3</Content>	</DisplayField>	<DisplayField id="EMAIL" header="Email" visible="true">		<DisplayFieldElement name="Field1" schema-element="xnat:investigatorData.email"/>	</DisplayField>	<DisplayField id="PHONE" header="Phone" visible="true">		<DisplayFieldElement name="Field1" schema-element="xnat:investigatorData.phone"/>	</DisplayField>	<DisplayVersion versionName="listing" default-order-by="INVESTIGATOR_ID" brief-description="Investigator" dark-color="99FF99" light-color="CCFFCC">		<DisplayFieldRef id="RPT"/>		<DisplayFieldRef id="INVESTIGATOR_ID"/>		<DisplayFieldRef id="INVESTIGATOR_NAME"/>		<DisplayFieldRef id="EMAIL"/>		<DisplayFieldRef id="PHONE"/>	</DisplayVersion></Displays>
