<?xml version="1.0" encoding="UTF-8"?><!-- edited with XMLSPY v2004 rel. 3 U (http://www.xmlspy.com) by Tim Olsen (Washington University) --><!--Sample XML file generated by XMLSPY v2004 rel. 3 U (http://www.xmlspy.com)--><Displays xmlns:xsi="http://www.w3.org/2001/XMLSchema-instance" xsi:noNamespaceSchemaLocation="../../xdat/display.xsd" schema-element="xdat:role_type">	<DisplayField id="ROLE_NAME" header="Role" visible="true">		<DisplayFieldElement name="Field1" schema-element="xdat:role_type.role_name"/>		<HTML-Link>			<Property name="HREF" value="@WEBAPPapp/action/DisplayItemAction/search_value/@Field1/search_element/xdat:role_type/search_field/xdat:role_type.role_name">				<InsertValue id="Field1" field="ROLE_NAME"/>			</Property>			<Property name="ONCLICK" value="return rpt('@Field1','xdat:role_type','xdat:role_type.role_name');">				<InsertValue id="Field1" field="ROLE_NAME"/>			</Property>		</HTML-Link>	</DisplayField>	<DisplayField id="RPT" header="" visible="true" image="true">		<Content type="sql">'/@WEBAPP/images/r.gif'::text</Content>		<HTML-Link>			<Property name="HREF" value="@WEBAPPapp/action/DisplayItemAction/search_value/@Field1/search_element/xdat:role_type/search_field/xdat:role_type.role_name">				<InsertValue id="Field1" field="ROLE_NAME"/>			</Property>			<Property name="ONCLICK" value="return rpt('@Field1','xdat:role_type','xdat:role_type.role_name');">				<InsertValue id="Field1" field="ROLE_NAME"/>			</Property>		</HTML-Link>	</DisplayField>	<DisplayField id="ACTIVE" header="" visible="true" image="true">		<DisplayFieldElement name="Field1" schema-element="xdat:role_type.meta.status"/>		<Content type="sql">CASE @Field1 WHEN 'active' THEN '/@WEBAPP/images/cg.gif' ELSE  '/@WEBAPP/images/cr.gif' END</Content>	</DisplayField>	<DisplayField id="DESCRIPTION" header="Description" visible="true">		<DisplayFieldElement name="Field1" schema-element="xdat:role_type.description"/>	</DisplayField>	<DisplayField id="ACTION_COUNT" header="Actions" visible="true">		<DisplayFieldElement name="Field1" viewName="ROLE_COUNT" viewColumn="ACTION_COUNT"/>	</DisplayField>	<DisplayField id="SEQ" header="Sequence" visible="true">		<DisplayFieldElement name="Field1" schema-element="xdat:role_type.sequence"/>	</DisplayField>	<DisplayVersion versionName="listing" default-order-by="ROLE_NAME" brief-description="Users" dark-color="DEDEDE" light-color="FFFFFF">		<DisplayFieldRef id="ROLE_NAME"/>		<DisplayFieldRef id="DESCRIPTION"/>		<DisplayFieldRef id="SEQ"/>		<DisplayFieldRef id="ACTION_COUNT"/>	</DisplayVersion>	<ViewLink alias="ROLE_COUNT">		<Mapping TableName="ROLE_COUNT">			<MappingColumn rootElement="xdat:role_type" fieldElement="xdat:role_type.role_name" mapsTo="role1"/>		</Mapping>	</ViewLink>	<SQLView name="ROLE_COUNT" sql="SELECT role_name AS role1,COUNT (map.xdat_a_xdat_action_type_allowe_xdat_role_type_id) AS ACTION_COUNT FROM xdat_role_type role LEFT JOIN xdat_a_xdat_action_type_allowe_xdat_role_type map ON role.role_name=map.xdat_role_type_role_name GROUP BY role_name"/></Displays>
