<?xml version="1.0" encoding="UTF-8"?>
<Displays xmlns:xsi="http://www.w3.org/2001/XMLSchema-instance" xsi:noNamespaceSchemaLocation="../../xdat/display.xsd" schema-element="xdat:infoEntry" full-description="Info" brief-description="Info">
	<DisplayField id="INSERT_DATE" header="Inserted" visible="true" searchable="true" data-type="string">
		<DisplayFieldElement name="Field1" schema-element="xdat:infoEntry.meta.insert_date"/>
	</DisplayField>
	<DisplayField id="INSERT_USER" header="Creator" visible="true" searchable="true" data-type="string">
		<DisplayFieldElement name="Field1" schema-element="xdat:infoEntry.meta.insert_user.login"/>
	</DisplayField>
	<DisplayField id="DATE" header="date" visible="true" searchable="true">
		<DisplayFieldElement name="Field1" schema-element="xdat:infoEntry/date"/>
	</DisplayField>
	<DisplayField id="TITLE" header="title" visible="true" searchable="true">
		<DisplayFieldElement name="Field1" schema-element="xdat:infoEntry/title"/>
	</DisplayField>
	<DisplayField id="DESCRIPTION" header="description" visible="true" searchable="true">
		<DisplayFieldElement name="Field1" schema-element="xdat:infoEntry/description"/>
	</DisplayField>
	<DisplayField id="LINK" header="link" visible="true" searchable="true">
		<DisplayFieldElement name="Field1" schema-element="xdat:infoEntry/link"/>
	</DisplayField>
	<DisplayVersion versionName="listing" default-order-by="DATE" default-sort-order="DESC" brief-description="Info" dark-color="9999CC" light-color="CCCCFF">
		<DisplayFieldRef id="DATE"/>
		<DisplayFieldRef id="TITLE"/>
		<DisplayFieldRef id="DESCRIPTION"/>
		<DisplayFieldRef id="LINK"/>
	</DisplayVersion>
	<DisplayVersion versionName="full" default-order-by="DATE" default-sort-order="DESC" brief-description="Info" dark-color="9999CC" light-color="CCCCFF">
		<DisplayFieldRef id="DATE"/>
		<DisplayFieldRef id="TITLE"/>
		<DisplayFieldRef id="DESCRIPTION"/>
		<DisplayFieldRef id="LINK"/>
	</DisplayVersion>
</Displays>
