<?xml version="1.0" encoding="UTF-8"?><!-- edited with XMLSPY v2004 rel. 3 U (http://www.xmlspy.com) by Tim Olsen (Washington University) --><!--Sample XML file generated by XMLSPY v2004 rel. 3 U (http://www.xmlspy.com)--><Displays xmlns:xsi="http://www.w3.org/2001/XMLSchema-instance" xsi:noNamespaceSchemaLocation="../../xdat/display.xsd" schema-element="xdat:userGroup">	<DisplayField id="ID" header="ID" visible="true">		<DisplayFieldElement name="Field1" schema-element="xdat:userGroup.id"/>		<HTML-Link>			<Property name="HREF" value="@WEBAPPapp/action/DisplayItemAction/search_value/@Field1/search_element/xdat:user/search_field/xdat:userGroup.ID">				<InsertValue id="Field1" field="ID"/>			</Property>			<Property name="ONCLICK" value="return rpt('@Field1','xdat:userGroup','xdat:userGroup.ID');">				<InsertValue id="Field1" field="ID"/>			</Property>		</HTML-Link>	</DisplayField>	<DisplayField id="DISPLAY_NAME" header="Name" visible="true" sort-order="ASC">		<DisplayFieldElement name="Field1" schema-element="xdat:userGroup.displayName"/>	</DisplayField>	<DisplayVersion versionName="listing" default-order-by="ID" brief-description="Users" dark-color="DEDEDE" light-color="FFFFFF">		<DisplayFieldRef id="ID"/>		<DisplayFieldRef id="DISPLAY_NAME"/>	</DisplayVersion></Displays>