<?xml version="1.0" encoding="UTF-8"?><!--Sample XML file generated by XMLSPY v2004 rel. 3 U (http://www.xmlspy.com)--><Displays xmlns:xsi="http://www.w3.org/2001/XMLSchema-instance" xsi:noNamespaceSchemaLocation="../../xdat/display.xsd" schema-element="xdat:element_security">	<DisplayField id="ELEMENT_NAME" header="Element" visible="true">		<DisplayFieldElement name="Field1" schema-element="xdat:element_security.element_name"/>		<HTML-Link>			<Property name="HREF" value="@WEBAPPapp/action/DisplayItemAction/search_value/@Field1/search_element/xdat:element_security/search_field/xdat:element_security.element_name">				<InsertValue id="Field1" field="ELEMENT_NAME"/>			</Property>			<Property name="ONCLICK" value="return rpt('@Field1','xdat:element_security','xdat:element_security.element_name');">				<InsertValue id="Field1" field="ELEMENT_NAME"/>			</Property>		</HTML-Link>	</DisplayField>	<DisplayField id="SECURE" header="Secured" visible="true" sort-order="DESC" image="true">		<DisplayFieldElement name="Field1" schema-element="xdat:element_security.secure"/>		<Content type="sql">CASE @Field1 WHEN 1 THEN '/@WEBAPP/images/cg.gif' WHEN 0 THEN '/@WEBAPP/images/cr.gif' END</Content>	</DisplayField>	<DisplayField id="BROWSE" header="Browse" visible="true" sort-order="DESC" image="true">		<DisplayFieldElement name="Field1" schema-element="xdat:element_security.browse"/>		<Content type="sql">CASE @Field1 WHEN 1 THEN '/@WEBAPP/images/cg.gif' WHEN 0 THEN '/@WEBAPP/images/cr.gif' END</Content>	</DisplayField>	<DisplayField id="SEQUENCE" header="Order" visible="true" sort-order="ASC">		<DisplayFieldElement name="Field1" schema-element="xdat:element_security.sequence"/>	</DisplayField>	<DisplayVersion versionName="listing" default-order-by="ELEMENT_NAME" brief-description="Users" dark-color="DEDEDE" light-color="FFFFFF">		<DisplayFieldRef id="ELEMENT_NAME"/>		<DisplayFieldRef id="SECURE"/>		<DisplayFieldRef id="BROWSE"/>	</DisplayVersion></Displays>