<?xml version="1.0" encoding="UTF-8"?>
<!--
  ~ D:/Development/XNAT/1.6/xnat_builder_1_6dev/plugin-resources/project-skeletons/xnat/src/schemas/security/display/xdat_stored_search_display.xml
  ~ XNAT http://www.xnat.org
  ~ Copyright (c) 2014, Washington University School of Medicine
  ~ All Rights Reserved
  ~
  ~ Released under the Simplified BSD.
  ~
  ~ Last modified 2/7/14 12:19 PM
  -->
<Displays xmlns:xsi="http://www.w3.org/2001/XMLSchema-instance" xsi:noNamespaceSchemaLocation="../../xdat/display.xsd" schema-element="xdat:stored_search" full-description="Bundles" brief-description="Bundles">
	<DisplayField id="ROOT_ELEMENT_NAME" header="pivot" visible="true" searchable="true">
		<DisplayFieldElement name="Field1" schema-element="xdat:stored_search/root_element_name"/>
	</DisplayField>
	<DisplayField id="SORT_BY_ELEMENT_NAME" header="sort by" visible="true" searchable="true">
		<DisplayFieldElement name="Field1" schema-element="xdat:stored_search/sort_by/element_name"/>
	</DisplayField>
	<DisplayField id="SORT_BY_FIELD_ID" header="sort by" visible="true" searchable="true">
		<DisplayFieldElement name="Field1" schema-element="xdat:stored_search/sort_by/field_ID"/>
	</DisplayField>
	<DisplayField id="LAYERED_SEQUENCE" header="Sequence" visible="true" searchable="true">
		<DisplayFieldElement name="Field1" schema-element="xdat:stored_search/layeredSequence"/>
	</DisplayField>
	<DisplayField id="ID" header="ID" visible="true" searchable="true">
		<DisplayFieldElement name="Field1" schema-element="xdat:stored_search/ID"/>
		<HTML-Link>
			<Property name="HREF" value="@WEBAPPapp/action/DisplayItemAction/search_value/@Field1/search_element/xdat:stored_search/search_field/xdat:stored_search.ID">
				<InsertValue id="Field1" field="ID"/>
			</Property>
			<Property name="ONCLICK" value="return rpt('@Field1','xdat:stored_search','xdat:stored_search.ID');">
				<InsertValue id="Field1" field="ID"/>
			</Property>
		</HTML-Link>
	</DisplayField>
	<DisplayField id="DESCRIPTION" header="Full Desc" visible="true" searchable="true">
		<DisplayFieldElement name="Field1" schema-element="xdat:stored_search/description"/>
	</DisplayField>
	<DisplayField id="BRIEF_DESCRIPTION" header="Brief Desc" visible="true" searchable="true">
		<DisplayFieldElement name="Field1" schema-element="xdat:stored_search/brief-description"/>
	</DisplayField>
	<DisplayVersion versionName="listing" default-order-by="ROOT_ELEMENT_NAME" default-sort-order="DESC" brief-description="bundle" dark-color="9999CC" light-color="CCCCFF">
		<DisplayFieldRef id="ID"/>
		<DisplayFieldRef id="BRIEF_DESCRIPTION"/>
		<DisplayFieldRef id="DESCRIPTION"/>
		<DisplayFieldRef id="ROOT_ELEMENT_NAME"/>
		<DisplayFieldRef id="SORT_BY_ELEMENT_NAME"/>
		<DisplayFieldRef id="SORT_BY_FIELD_ID"/>
		<DisplayFieldRef id="LAYERED_SEQUENCE"/>
	</DisplayVersion>
</Displays>
